{
  "schemaVersion": "0.1.0",
  "contractType": "deck-spec",
  "deckId": "formula-transplant-deck",
  "projectId": "formula-transplant-project",
  "templateProfileId": "synthetic-template-profile",
  "projectOverlayId": "formula-transplant-project-overlay",
  "slides": [
    {
      "slideId": "formula-output-one",
      "capabilitySelectionId": "formula-transplant-selection",
      "payload": {
        "displayMode": "display",
        "latex": "\\frac{a}{b}"
      }
    }
  ]
}
